RecallID,RecallNumber,RetailerFirm
7762,16752,"Independent specialty bicycle stores nationwide from October 2015 through April 2016 for between $4,000 and $8,000."
7759,16187,Ad Specialty Distributors as a promotional item from August 2015 through April 2016 for about $3.
7761,16751,Bob?s Discount Furniture stores nationwide and online at www.MyBobs.com from August 2010 through July 2014 for about $400.
7758,16186,"Kmart, Toys R Us, Walmart and other retailers sold the Shimmer N? Sparkle Cra-Z-Art Cra-Z-Jewelz Gem Creations Ultimate Gem Machine from August 2015 through April 2016 for $30. Toys R Us, Walmart and other retailers sold the Shimmer N? Sparkle Cra-Z-Art Cra-Z-Jewelz Gem Creations Gem Charm and Slider Bracelets from August 2015 through April 2016 for $10. Target stores sold the My Look Cra-Z-Art Cra-Z-Jewelz Gem Creations Ultimate Gem Machine from August 2015 through April 2016 for $30."
7760,16750,Online at www.upliftdesk.com and www.thehumansolution.com from January 2016 through March 2016 for about $220.
7757,16749,"Huppins audio store in Spokane, Wash., and online at amazon.com, gomohu.com and onecall.com from December 2015 through April 2016 for between $300 and $500."
7755,16183,Lowe?s and other home and hardware stores nationwide and online at lowes.com and other websites from June 2013 through February 2016 for about $15.
7756,16185,HobbyTown and other hobby stores and Traxxas dealers nationwide from November 2015 through January 2016. The X-Maxx truck sold for about $840. The electronic speed control sold for about $250.
7754,16184,"Heating, plumbing and building supply retailers nationwide and online from February 2016 through March 2016 for about $240."
7753,16182,Various distributors and independent retailers nationwide and online at Amazon.com and BeaverTools.com from January 2013 through March 2016 for about $500.
7752,16179,"BuyBuy Baby, CVS, Giant, Kohl?s, Marco Baby, Marshalls, Meijer, Sam?s Club, Ross Stores, Target, Bealls Outlet, Walgreens and Wal-Mart and other mass merchandise stores nationwide and online at Amazon.com, Babyhaven.com, and Diapers.com from December 2014 through May 2016 for between $4 and $7."
7747,16176,Independent bike shops and online at www.danscomp.com and www.jrbicycles.com from July 2013 through April 2015 for about $300.
7749,16748,"Ethan Allen Design Centers nationwide from October 2007 through January 2016 for about $2,500."
7750,16180,"Bed, Bath & Beyond stores nationwide and online at www.bedbathandbeyond.com from August 2015 through January 2016 for between $110 and $170."
7748,16178,REI and specialty outdoor retailers nationwide and online at amazon.com and rei.com from January 2016 through May 2016 for between $250 and $330.
7751,16177,The Home Depot stores nationwide and online from January 2014 through April 2016 for between $450 and $720.
7745,16747,"Authorized Hed dealers nationwide and online from January 2016 to March 2016 for between $700 for an individual wheel and $2,400 for a set of wheels."
7743,16746,Honda Power Equipment dealers and Home Depot stores nationwide and online at www.homedepot.com from December 2007 through March 2016 for between $350 and $380.
7744,16175,"Online at Amazon.com, ATC.com, eBay.com, Greatdealfurniture.com, Groupon.com, Houzz.com, Overstock.com and Wayfair.com from October 2013 through March 2015 for about $120."
7746,16174,T.J. Maxx and Marshalls stores nationwide during March 2016 for about $40.
6742,16172,Electrical supply distributors from May 2011 through June 2012 for about $40.
6743,16173,Wholesale and hardware distributors from April 2015 through November 2015 for about $460
6741,16171,Plumbing contractors nationwide from May 2015 through February 2016 for between $400 and $820.
6740,16745,"Online at appliancesconnection.com, Cymax.com and Wayfair.com from June 2014 through October 2015 for about $300."
6738,16168,"Eastern Mountain Sports, Gear Express, Mountain Gear, REI and other specialty outdoor recreation stores nationwide and online at BackCountry.com and BlackDiamond.com for between $65 and $130."
6737,16164,"Eastern Mountain Sports, Moosejaw Mountaineering, Outdoors Inc., REI, Sport Chalet, and other specialty outdoor stores nationwide and online at Backcountry.com and BlackDiamond.com and for about $80."
6739,16169,"Camp Saver, Gear Saver Inc., The Gear Coop and other specialty outdoor stores nationwide and online at BlackDiamond.com for between $90 and $110."
6736,16167,"Home Depot and other hardware stores, industrial distributors and electrical wholesalers nationwide from November 2015 through April 2016 for between $55 and $75."
6735,16165,"Rocky Mountain bicycle dealers nationwide and online at www.Bikes.com (Rocky Mountain Bicycles), www.Ems.com (Eastern Mountain Sports), www.JensonUsa.com, www.MikesBikes.com and www.PerformanceBike.com from May 2002 through April 2016 from between $250 and $15,000."
6733,16166,"Authorized SCOTT dealers nationwide and online from June 2015 through March 2016 for between $3,300 and $9,700."
6732,16163,"Baby Street, Dainty Baby, Mega Babies and other baby product and specialty stores nationwide and online at Amazon.com, diapers.com and philandteds.com from August 2015 through April 2016 for about $550."
6730,16162,Target stores and online at www.target.com from January 2014 through April 2016 for between $18 and $25.
6731,16159,Target stores nationwide from October 2015 through December 2015 for about $20.
6728,16160,Hobby Lobby Stores nationwide from January 2016 through April 2016 for about $5.
6727,16161,Hobby Lobby Stores nationwide from January 2016 through April 2016 for about $7.
6729,16744,"Authorized Kubota dealers nationwide from 2010 to 2015 for between $21,000 and $22,000."
6725,16158,"Lowe?s, Menards, The Home Depot and other home improvement, hardware stores nationwide and online at Amazon.com, HomeDepot.com, Lowes.com and Menards.com from March 2015 through November 2015 for between $50 and $200, depending on the model and whether it was sold in a combination package with other tools."
6726,16157,Boutique stores nationwide and online at Amazon.com and TwinGoCarrier.com from December 2014 through May 2016 for about $215.
6722,16741,"Authorized Honda Powersports dealers nationwide from February 2016 through April 2016 for between $14,000 and $17,200."
6723,16743,Online at www.Bednest.com from March 2010 through December 2015 for between $400 and $500 or if rented between $170 and $200.
6724,16742,"Cybex direct sales force or its distributors directly to gyms nationwide from December 2008 through September 2015 for about $1,100."
6721,16740,"Can-Am dealers nationwide from April 2012 through April 2016 for between $12,600 and $20,100."
6720,16156,"Babies R Us, Target, Wal-Mart and other mass merchandisers, juvenile product, baby boutique and discount stores nationwide and online at amazon.com, munchkin.com and other website from March 2014 through March 2016 for between $11 and $15."
6719,16155,REI and other outdoor recreation stores nationwide and online at Amazon.com and other websites from September 2014 through January 2016 for between $60 and $70.
6718,16154,Walmart stores nationwide and online at Walmart.com from March 2011 through October 2015 for about $14.
6717,16739,"Cub Cadet dealers nationwide from April 2015 through October 2015 for between $8,500 to $9,500."
6715,16152,Sam's Club stores nationwide from May 2015 through September 2015 for about $20.00.
6714,16151,"Online at www.homedepot.com from November 2015 through February 2016 for about $280 (unit only) and $350 (part of a kit which contains a Ryobi 40-Volt Brushless Snow Blower, a Ryobi 40-Volt Lithium Ion Battery, and a Ryobi 40-Volt Lithium Ion Battery Charger)."
6716,16153,"Authorized Stile/Tern dealers nationwide from January 2012 to April 2016 for between $1,800 and $3,000."
6713,16150,Averroes International stores and online at amazon.com and souvnear.com from October 2014 through March 2016 for between $8 and $40.
6712,16149,"Lowe?s, Menards and Orgill Inc. stores nationwide from January 2013 through January 2016 for about $250."
6711,16148,"Adorama, Austin Canoe & Kayak, Moontrail, REI, The Clymb and other outdoor equipment retailers nationwide and online at www.amazon.com, www.backcountry.com, www.bhphotovideo.com, www.forestry-suppliers.com, and www.opticsplanet.com from February 2011 through May 2015 for about $300."
6710,16147,Flying Tiger Copenhagen in New York from November 2015 through December 2015 for about $3.
6708,16145,"Specialty toy stores nationwide and online at Amazon.com, Gilt.com, HighlightsforChildren.com, ToysRUs.com and Zulily.com from July 2015 through February 2016 for about $33."
6706,16141,Academy Sports + Outdoors stores nationwide and online at www.academy.com from September 2015 through December 2015 for about $20.
6705,16143,"buybuyBaby, Target and other stores nationwide and online at Amazon.com and other websites from November 2015 through March 2016 for about $170."
6707,16144,Staples stores nationwide and online at Staples.com and Quill.com from January 2014 through January 2016 for about $215.
6703,16142,"Inline Warehouse, Paragon Athletic Goods, Summit Sports and other sporting goods stores and Rollerblade helmet dealers nationwide and online at www.amazon.com, www.inlineskates.com, www.inlinewarehouse.com and www.rollerblade.com from November 2014 through January 2016 for about $60."
6704,16738,"Yamaha side-by-side dealers nationwide from September 2015 to February 2016 for between $19,800 and $21,600."
6702,16140,"Academy Sports + Outdoors, Green Supply, Sportsman?s Supply Company and sporting goods stores nationwide and online at www.coleman.com and www.amazon.com from January 2014 through August 2015 for between $65 and $75."
6700,16138,"PGA Tour Superstore, The Golfer?s Warehouse, Worldwide Golf Shops and other authorized golf dealers nationwide and online at www.amazon.com and www.golfbuddyglobal.com from April 2015 through January 2016 for about $250."
6701,16139,IKEA stores nationwide and online at www.ikea-usa.com from November 2015 through February 2016 for about $13.
6699,16137,"Rainbow dealers nationwide from January 2007 through December 2011 and at several mass merchandisers including Sam?s Club, Toys R Us and Walmart from January 2009 through December 2009. The playsets retailed for between $900 and $10,000."
6697,16136,"Century 21, Lord & Taylor, Marshalls, TJ Maxx and Stein Mart retail stores nationwide, and online at amazon.com and loehmanns.com from October 2014 through January 2016 for between $ 12 and $68."
6698,16737,"Niposul stores in Massachusetts and NipoFlorida stores in Florida from July 2014 through October 2015 for between $1,200 and $6,500."
6695,16135,Online at www.eleanorrose.com from November 2014 through February 2016 for about $30.
6696,16736,"Barneys New York, Givenchy Boutiques, Maxfield and Forward, Neiman Marcus and Nordstrom stores nationwide from February 2016 through March 2016 for between $685 and $1,350."
6694,16133,H-E-B grocery stores in Texas from September 2015 through December 2015 for about $15.
6690,16734,"Online at www.Amazon.com, www.footedpajamas.com, www.sears.com and www.Zulily.com for $20 for infant sizes, $25 for toddler sizes and $30 for kids sizes."
6692,16134,Authorized distributors from May 2015 through August 2015 for about $800.
6693,16735,Distributors and dealers nationwide in the food service and hospitality industries from April 2008 through August 2015 for between $75 and $150.
6691,16129,"BuyBuy Baby and other toy stores nationwide, and online at Amazon.com and Kohls.com from September 2015 through January 2016 for about $15."
6689,16132,"Eastern Mountain Sports, Hansen Mountaineering, The Gear Coop, Peak Experiences Inc., REI and other specialty outdoor stores nationwide and online at Backcountry.com and BlackDiamond.com from January 2014 through February 2016 for between $5 and $9."
6687,16130,"Eastern Mountain Sports, The Gear Coop, Hansen Mountaineering, REI and other specialty outdoor stores nationwide and online at Backcountry.com, BlackDiamond.com and Bouldering.com from December 2014 to January 2016 for between $6 and $15."
6688,16131,"Office Depot, Staples and other electronics stores nationwide, and online at Toshibadirect.com and other websites from June 2011 through January 2016 for between $500 and $1,000 for the laptop and between $70 and $130 for the battery pack."
6686,16124,Home Depot stores nationwide and online at HomeDepot.com from May 2011 through June 2014 for about $40.
6685,16128,Authorized Specialized retailers nationwide and online at www.specialized.com from June 2014 through February 2016 for between $100 and $275 for Flux model headlights and taillights and for between $30 and $50 for Stix model headlights and taillights.
6684,16126,"Panasonic dealers from December 2011 through August 2013 for about $2,000 for the laptop."
6682,16123,IKEA stores nationwide and online at www.ikea-usa.com from October 2015 through February 2016 for between $20 and $50.
6683,16125,"RacerMate and bicycle stores nationwide from November 1997 through November 2008 for about $1,500."
6681,16120,"GE Lighting authorized dealers and electrical distributors nationwide, including Crescent Electric Supply Company, Graybar and W.W. Grainger Industrial Supply from September 2015 through December 2015 for between $250 and $300."
6680,16121,"Specialty bicycle stores nationwide from March 2015 through December 2015 for about $47 for the stainless steel quick release and about $84 for the titanium quick release. Wheel sets equipped with the quick releases were sold for between $1,000 and $3,600."
6679,16122,"Speciality bicycle stores nationwide from May 2010 through January 2015. The front hubs sold for about $215. Complete front wheels with the hubs sold for between $1,035 and $1,325. The front wheel was also sold as a wheel set with a rear wheel for between $2,300 and $2,950."
6678,16119,"Distributors, contractors and gasoline stations nationwide from April 2015 through September 2015 for swivel fittings with �-inch hoses and May 2015 through October 2015 for swivel fittings with 1-inch hoses. The hose/swivel fitting sets were sold for between $18 and $400."
6676,16733,Room & Board stores nationwide and online at www.roomandboard.com from May 2015 through December 2015 for between $350 and $520 for the arm chairs and between $300 and $400 for the side chairs?.
6675,16732,"Independent pool supply stores and dealers nationwide from September 2014 to November 2014 for about $3,000."
6674,16731,Heating and plumbing contractors that install Williamson-Thermoflo heating and plumbing equipment nationwide from April 2015 through November 2015 for about $500 for the burners.
6672,16730,"Authorized KYMCO dealers nationwide from June 2014 through November 2015 for between $8,000 and $8,700."
6673,16116,Z Gallerie stores nationwide and online at ZGallerie.com between July 2015 and January 2016 for about $400.
6671,16115,"Lowe?s Home Improvement stores nationwide and and online at www.dlawlesshardware.com, www.flyingbulldogs.com, www.lowes.com and www.riverbend.builders from January 2013 through January 2016 for between $5 and $27."
6670,16113,"Sports and specialty stores nationwide, online at Amazon.com and other industrial supply dealers or distributors from May 2014 through January 2016 for between $240 to $280 for the flashlights and between $50 and $70 for the replacement battery packs."
6669,16112,Target Stores nationwide and online at www.target.com between December 2015 and January 2016 for about $8.
6667,16110,Grainger stores nationwide and online at Amazon.com and AmbientWeather.com from October 2012 through June 2014 for between $30 and $90.
6668,16111,PetSmart stores nationwide and online from September 2015 through December 2015 for between $15 and $64.
6666,16729,"Heating and Plumbing contractors or wholesalers to consumers nationwide from September 2015 through December 2015 for about $4,800 and $5,800."
6665,16109,"Lowe?s and specialty hardware stores nationwide and online at www.lowes.com from September 2015 through December 2015 for about $1,500."
6659,16106,"Apple stores and other home electronics stores, and online at Apple.com from January 2003 through January 2015 for about $30."
6661,16108,REI and other sporting goods stores nationwide and online at promotive.com from August 2013 through July 2015 for between $100 and $130.
6664,16727,Authorized ENVE dealers nationwide and online from June 2014 through December 2015 for about $540 for the fork.
6662,16728,"J. Crew and Crewcuts stores nationwide, the J. Crew catalog and online at www.jcrew.com from August 2015 through January 2016 for about $155."
6663,16107,Davies Office in New York and Office Furniture Depot stores in New Jersey and by other independent distributors from January 2015 through November 2015 for about $300.
6660,16105,"REI and other retailers nationwide and online, including at REI.com and Backcountry.com, from June 2015 through October 2015 for between $100 to $750."
6656,16102,"Goodman and heating and cooling equipment dealers nationwide from January 2007 through June 2008 for between $700 and $1,000."
6658,16103,Michaels stores nationwide from October 2015 through November 2015 for about $4 for the stem and $7 for the bush
6657,16104,"Michaels stores nationwide from October 2015 through November 2015 for between $5 and $20, depending upon the size of the box."
6655,16101,"Distributed in Arizona, Idaho, Kentucky, Minnesota, Montana, Nebraska, North Dakota, South Dakota, Washington, Wisconsin and Utah, delivered by various companies and sold by retailers between April 2009 and October 2015."
6654,16100,"Albee Baby, Giggle, Magic Bean, Nordstrom and other specialty stores nationwide and online at www.nuna.eu and www.wayfair.com and other online retailers from February 2013 through November 2015 for about between $250 and $300."
6653,16726,"Arctic Cat dealers nationwide from June 2015 through January 2016 for between $14,000 and $16,000."
6652,16099,Pier 1 Imports stores nationwide and online at Pier1.com from January 2015 through October 2015 for between $240 and $500.
6651,16097,Cracker Barrel Old Country Store nationwide and online at www.crackerbarrel.com from September 2015 through November 2015 for about $13.
6650,16098,"IKEA stores worldwide and online at www.ikea-usa.com from October 2012 through January 2016 for about $13 for the HYBY ceiling lamp, and from November 2002 through January 2016 for about $5 for the LOCK ceiling lamp."
6644,16096,"Bed, Bath & Beyond stores nationwide and online at www.bedbathandbeyond.com from August 2015 through October 2015 for about $20."
6645,16092,Dollar General stores nationwide and online at www.dollargeneral.com from July 2015 through December 2015 for about $10.
6647,16093,Specialty ski and snowboard shops and online from January 2015 through December 2015 for between $80 and $120.
6648,16094,Independent toy and music retailers and online at amazon.com and gogreentones.com from January 2015 through September 2015 for about $40.
6646,16095,"Bloomingdales, Macy?s, and WWRD Outlets and other department stores nationwide and online at www.amazon.com and www.wedgwood.com from April 2015 through December 2015 for between $75 and $95."
6643,16090,"Eastwood stores in Chicago, Parma, Ohio and Pottstown, Pa., in Eastwood?s catalog and online at www.eastwood.com and other websites from January 2015 through October 2015 for between $50 and $110."
6642,16091,"Home Depot, Lowes, specialty window shading dealers and online at SerenaShades.com from November 2013 through November 2015 for between $280 and $2,400."
6640,16089,"Microsoft stores, Best Buy, Costco and other stores nationwide, and online at www.microsoft.com, from February 2013 through March 15, 2015 for between $800 and $2,000 for the Surface Pro computer and between $64 and $80 for the power supply unit sold separately."
6641,16088,"ABC Warehouse, Boardman Furniture, Fred?s, Walmart stores nationwide, Dirt Devil via telephone and online at www.dirtdevil.com, www.ebay.com and www.walmart.com from February 2014 through November 2015 for between $45 and $70."
6649,16082,"Authorized Scubapro dealers nationwide from May 2015 through January 2016 for between $700 and $1,200."
6635,16085,H-E-B stores in Texas from September 2014 through December 2015 for between $20 and $250.
6638,16087,"buybuy Baby and Whole Foods nationwide and online at amazon.com, babyhaven.com, diapers.com, drugstore,com and target.com from June 2015 through December 2015 for about $15 for the 2-ounce size and $20 for the 4-ounce size."
6637,16725,"Online at Amazon.com, eBay.com and Renogy-store.com from May 2015 through October 2015 for about $300."
6636,16084,"Bed Bath & Beyond, Dollar General and other retail stores nationwide, online at Amazon.com and BuyAquaRug.com, by Tristar through direct response television commercials, and through a live television show on QVC, from July 2012 to September 2015 for between $18 and $28."
6639,16086,Lighting showrooms nationwide and online through lighting and home improvement websites from April 2013 to September 2015 for between $320 and $420.
6634,16083,"Distributors to schools, government agencies and other users from February 2015 to May 2015 for about $600."
6633,16724,"FSG, Grainger, Nedco, Standard Electric and other Lunera industrial/commercial retailers and online at www.1000bulbs.com and www.bulbs.com from October 2015 through December 2015 for about $25."
6630,16080,"Babies R Us, buybuy Baby, Target and other stores nationwide and online at Amazon.com, Diapers.com and other websites from April 2010 through January 2016 for about $500 for the stroller. The replacement top seats were sold by Britax from April 2010 through January 2016 for about $150."
6632,16723,"Sam?s Club stores nationwide and online at Amazon .com, Target.com and ToysRUs.com from November 2013 through November 2015 for between $55 and $80."
6631,16081,"Babies R Us, buybuy BABY, Target and other stores nationwide and online at Amazon.com, Diapers.com and other online retailers from November 2014 to January 2016 for between $210 and $250."
6626,16079,QVC televised shopping programs and online at QVC.com from November 2015 to December 2015 for about $55.
6629,16078,"Menards store in Ill., Ind., Iowa, Kan., Mich., Minn., Mo., Neb., N.D., Ohio, S.D. and Wis. from August 2015 through November 2015 for about $120."
6627,16076,"Walt Disney World� Resort in Lake Buena Vista, Florida, Disneyland� Resort in Anaheim, California, the Treasure Ketch Shop on the Disney Wonder� and Mickey?s Mainsail located on the Disney Magic�, Disney Dream� and Disney Fantasy� cruise ships from February 2015 through November 2015 for about $20."
6628,16077,"West Elm stores, online at www.westelm.com and the West Elm catalogue nationwide from July 2013 through November 2015 for between $370 and $500 for single stools and between $740 and $1,000 for a set of two."
6622,16073,Altar?d State stores nationwide from October 2015 through December 2015 for about $15.
6625,16075,IKEA stores nationwide and online at www.ikea-usa.com from November 2015 through December 2015 for about $10 for the LATTJO tongue drum and $15 for the LATTJO drumstick set.
6624,16722,"KTM authorized dealers nationwide from March 2015 through October 2015 for between $6,800 and $9,400. Husqvarna Motorcycles authorized dealers nationwide from March 2015 through October 2015 for between $6,900 and $9,400."
6623,16721,"Classroom Direct catalogs, School Specialty Furniture and Equipment catalogs, School Specialty Education Essentials catalogs, School Specialty Early Childhood catalogs, and on www.schoolspecialty.com from May 2015 through November 2015 for between $105 and $115."
6621,16074,"Steelcase independently owned dealers nationwide from August 2005 to June 2015 for between $500 and $1,550."
6620,16072,"BMX bicycle/product dealers, Stolen series BMX distributors and specialty bicycle retailers nationwide and online at www.QBP.com and other BMX bicycle/product websites from September 2015 through October 2015 for between $230 and $350."
6619,16071,Cost Plus World Market and World Market stores nationwide and online at www.worldmarket.com from July 2015 through October 2015 for about $240.
6617,16070,Pier 1 Imports stores nationwide and online at www.Pier1.com from January 2010 through August 2015 for between $200 and $400 for the hanging chair and stand.
6618,16062,Walmart stores nationwide and online at Walmart.com from July 2015 through December 2015 for about $20.
6615,16069,Office Depot and OfficeMax retail stores nationwide and online from October 2012 through September 2015 for about $140.
6616,16720,Zulily.com from November 2015 through December 2015 for about $25.
6614,16719,"KTM authorized dealers nationwide from December 2014 through April 2015 for between $9,000 and $10,200 for model year 2015 Motorcycles and from May 2015 through September 2015 for between $8,400 and $9,300 for model year 2016 Motorcycles."
6613,16718,"Authorized KTM dealers nationwide from August 2014 to December 2014 for about $7,900 for the 2015 model year, from June 2015 to July 2015 for about $8,000 for the 2016 model year."
6612,16068,Independent bicycles dealers nationwide between August 2012 and October 2015 for between $370 and $480.
6611,16067,"Macy?s stores nationwide and Military Exchanges, and online at www.macys.com between January 2011 and September 2015 for about $170 at Macy?s and $90 at Military Exchanges."
6608,16066,"Bed, Bath and Beyond, Best Buy, Macy?s, Sur la Table and Williams Sonoma stores nationwide and online, and online at Amazon.com and BrevilleUSA.com from September 2012 through October 2015 for about $180."
6607,16065,HVAC dealers and factory-direct sales from January 2002 through December 2009 for between $425 and $675.
