RecallID,RecallNumber,RetailerFirm
1202,12744,"PBteen.com and through the PBteen catalog nationwide from January 2008 to April 2009 for the Sun Valley white and Sun Valley honey models, and October 2011 to February 2012 for the dark espresso, chestnut and white models. The bunk beds were sold for between $1,700 and $2,000."
1112,12247,"Sears, Target, Toys R Us (including Babies R Us), USA Babies, Walmart, and various other toy and children's stores nationwide, and various online sellers, from August 2003 through August 2012 for between $30 and $50."
1111,12246,"B&H Photo, Best Buy and camera and mass merchandise stores nationwide and Amazon.com and other online retailers between June 2012 and July 2012 for between $850 and $1,200."
1110,12245,"Cost Plus World Market, Cracker Barrel Old Country Store and other retailers from September 2011 to February 2012 for about $3."
1109,12244,"Appliance dealers, authorized builder distributors and other stores nationwide from March 2006 through August 2009 for between $350 and $850."
1108,12242,Children's boutiques and specialty retailers and online nationwide from August 2011 through December 2011 for between $35 and $45.
1107,12241,Lowe's stores nationwide from August 2011 through February 2012 for about $98 for the set.
1106,12240,Sears and Kmart stores nationwide and Sears.com and Kmart.com from 2003 to 2009 for between $140 and $220.
1103,12238,"Mass merchandisers, grocery stores and independent toy and specialty stores nationwide and by online retailers from April 2012 to June 2012. The cars cost about $5 each or $18 for the set."
1102,12237,Outdoor camping and climbing stores nationwide from January 2010 through May 2012 for about $150 for the Kenta and $170 for the Kenta Plus models.
1101,12236,Home Depot Stores from September 2011 through April 2012 for about $30.
1100,12233,"Burlington Coat Factory and juvenile product specialty stores nationwide and online at Amazon.com, Target.com and other online retailers between February 2012 and July 2012 for about $250."
1098,12230,"Burlington Coat Factory, The Container Store and other retail stores nationwide from July 2011 through March 2012 for about $10."
1096,12229,Home Goods and other stores nationwide from June 2011 through June 2012 for between $13 and $25.
1199,12741,"Authorized Club Car dealers nationwide from March 2012 through May 2012 for between $5,000 and $7,000."
1095,12227,Furniture stores nationwide from August 2009 to April 2012 for between $300 and $400.
1094,12226,Independent specialty toy and retail stores from January through March 2012 for about $100.
1200,12742,"TRUMPF Medical Systems Inc. nationwide From January 2005 through December 2011 for about $2,100."
1090,12221,"Retail stores including Babies R Us, Burlington Coat Factory, Buy Buy Baby, Shopko and Toys R Us, as well as online outlets including Albeebaby.com, Amazon.com, Babyage.com, Babysupermart.com, Diapers.com and Target.com from January 2005 through July 2012 for between $100 and $150."
1091,12222,Family Dollar stores from September 2011 through December 2011 for $8.
1093,12224,The recalled stools were distributed free by various companies as promotional products between March 2012 and May 2012.
1092,12223,Old Navy stores in the U.S. and Canada and at oldnavy.com in the U.S. and at oldnavy.ca in Canada from February 2012 through June 2012. The shoes sold for between $12 and $15.
1088,12219,"Camera, office supply and mass merchandise stores, in catalogs and on various websites nationwide. They were sold with the digital SLR camera in Canada from February 2012 through March 2012 and in the U.S. from March 2012 through April 2012 for between $1,200 and $3,000."
1089,12220,"Walmart, Toys R Us, Academy and at other specialty stores, and online retailers from December 2011 through May 2012 for between $130 and $280."
1087,12218,Lowe's Home Centers nationwide and OC Tanner from January 2012 to April 2012.
1085,12216,"TJ Maxx and Marshalls in the U.S. from February 2012 through April 2012 and at Homesense, Winners and Marshalls in Canada in April 2012 for about $10."
1086,12217,"Williams-Sonoma, QVC and other national retailers and websites from June 2010 to March 2012 for approximately $50 for the Starter Set and $30 for the Bottle Set."
1084,12215,"Bed Bath & Beyond, Bonton, JCPenney, Kohls, Toys ""R"" Us stores nationwide as well as the online retailers Amazon, Ideeli, JCPenney, Kohls, Macy's and Overstock from June 2010 through March 2012 for between $10 and $20."
1081,12210,IKEA stores nationwide from September 2011 through March 2012 from $15 to $20.
1077,12206,Academy Sports and Outdoor stores in Texas from January 2010 to March 2011 for about $8.
1076,12205,"Children?s clothing and specialty retailers nationwide and online including at The Pajama Princess in Austin, Texas., Anklebiter?s in Roswell, Ga., Cute As A Button in Tarboro, N.C., Bhumbles in Winder, Ga., and www.bhumbles.com, from February 2010 to December 2011 for between about $20 and $50."
1083,12212,Lowe's stores nationwide and at www.lowes.com from September 2010 through March 2012 for about $90.
1075,12204,"PajamaGram website, telephone and catalogue from September 2011 through March 2012 for between $26 and $40."
1082,12211,"Independent spa dealers nationwide from March 2011 to March 2012 for between $6,000 and $12,000."
1079,12208,Furniture stores nationwide from August 2009 to April 2012 for between $400 and $500.
1198,12740,Costco stores nationwide from May 2011 through February 2012 for about $50.
1078,12207,"Catbike authorized dealers nationwide from February 2010 through December 2010 for about $2,350."
1197,12739,Servpro's independently-owned franchises nationwide from April 2004 through August 2010 for between $200 and $230.
1196,12738,"Fingerhut catalogs, Fingerhut.com and Gettington.com from July 2011 through January 2012."
1074,12202,Independent bicycle shops and electric bicycle shops nationwide and online at Walmart.com from March 2007 through March 2012 for between $850 and $1120.
1073,12201,"The Home Depot and Lowe's stores, distributors and plumbing contractors nationwide for about $108, and sold to toilet manufacturers including American Standard, Crane, Eljer, Gerber, Kohler, Mansfield and St. Thomas."
1072,12200,Big Lots stores nationwide from September 2010 through March 2012 for about $20 for Model #FH107A and $25 for Model #PTC-902T.
1195,12737,"Lowe's stores from February 2012 through March 2012 for between $800 and $1,000."
1069,12199,Flood remediation contractors and other service professionals nationwide from January 2003 through September 2011 for between $160 and $285.
1067,12197,Electrical distributors and lighting wholesalers nationwide from July 2010 through July 2011 for between $19 and $50 as Thomas Lighting products.
1066,12196,"Juvenile product specialty stores nationwide and online at Amazon.com, Target.com and ToysRUs.com from January 2006 and June 2012 for between $150 and $160."
915,12038,Sierra Trading Post nationwide from August 2003 through March 2006 for $3 to $32.
1065,12195,"Mass merchandise and warehouse stores, other retailers, distributors and on-line sellers nationwide between July 2007 and December 2008 in items that retailed between $5 and $28."
1064,12194,"Sporting goods stores, Nautilus.com and other online retailers from May 2011 through August 2011 for about $600."
1063,12193,"West Marine stores nationwide, online at westmarine.com and in the West Marine catalog from February 2012 to May 2012 for about $70."
1062,12192,"Toys ""R"" Us and Walmart stores nationwide and online at Walmart.com and Wayfair.com between December 2011 and June 2012 for about $40."
1061,12191,Major retailers nationwide from July 2008 through May 2012 for about $50-80.
1060,12190,"Equestrian riding stores, tack shops, saddlery dealers nationwide, through mail order and by online equestrian retailers from July 2003 through April 2012 for between $30 and $51."
1058,12189,"ECHO Bear Cat dealers nationwide from October 2007 through March 2012 for about $2,600."
1057,12188,"Toys ""R"" Us stores nationwide and online via www.toysrus.com from August 2009 through September 2010 for about $25."
1194,12736,Through the Stoneberry catalog and website from January 2012 and March 2012 for about $160. Stoneberry is owned by Mason Companies.
1056,12187,Midwest retail stores Pamida and Sutherlands from June 2009 to April 2012 for about $20.
1193,12735,"Chicago Century Furniture Inc. 3034 South Wentworth Ave., Chicago, Ill., from January 2008 through October 2010 for between $190 and $360."
1054,12184,Lowe's stores nationwide from May 2011 to December 2011 for about $20.
1055,12185,"Authorized distributors nationwide from May 2008 through February 2012 for between $50 and $100, depending on options and finish type."
1053,12183,The stems were sold at specialty bicycle retailers and via websites from January 2005 through April 2010 for about $59.
1051,12181,"Toys ""R"" Us stores nationwide from September 2010 through April 2012 for between $45 and $70."
1052,12182,Costco retail stores and Costco.com from about October 2011 through March 2012 for about $200 for the complete set.
1192,12734,"Online at www.porterathletic.com, by telephone and direct sales through authorized Porter Athletic distributors nationwide from September 2009 through September 2011 for between $387 and $877."
1050,12180,"Bed, Bath and Beyond, Burlington Coat Factory, Great Beginnings, Home Depot, Target and Walmart from January 2005 through April 2010 for between $8 and $20 for the toilet locks, and from January 2000 through March 2009 for between $2 and $11 for the cabinet locks. Amazon.com sold both locks through April 2012."
1048,12178,dd?s Discounts stores nationwide from August 2011 through December 2011 for about $8.
1042,12171,"HomeGoods, Marshalls, TJ Maxx and other retailers nationwide from January 2010 through January 2012 for between $8 and $12."
1046,12175,Bicycle retail stores nationwide and on Internet retailers from January 2011 through March 2012 for about $80.
1047,12176,Dillard's stores nationwide and online at www.dillards.com between September 2011 and November 2011 for about $25.
1044,12173,Mass market and independent juvenile specialty stores nationwide and online from July 2008 through May 2012 for between about $50 and $100.
1043,12172,Walmart stores nationwide from February 2009 through February 2012 for about $275.
1039,12169,"East Coast Surf Products, Hansens Surfboards, Huntington Surf & Sport, Jacks Surf and Sport, Main Beach Surf & Sport, O'Neill, Riders Outlet, Sports Chalet, Valley Skate N Surf and other surfing specialty stores nationwide between September 2011 and December 2011 for about $60"
1036,12166,dd's Discounts stores nationwide from October 2011 through January 2012 for about $6.
1038,12168,dd's Discounts stores nationwide from December 2011 through January 2012 for about $13.
1037,12167,dd's Discounts stores nationwide from January 2011 through January 2012 for about $10.
1041,12170,dd's Discounts stores nationwide from December 2011 through January 2012 for about $10.
1191,12733,Havertys Furniture Companies from October 2010 through March 2012 for between $270 and $300 depending on the model.
1190,12732,"Exmark dealers nationwide from March 2009 through April 2010 for between $4,200 and $4,400."
1035,12164,"Christmas Tree Shops in the Northeast, Mid-Atlantic and Midwest from July 2011 through March 2012 for about $5."
1032,12161,"Specialty toy and baby stores nationwide, in Canada, and online at www.manhattantoy.com from September 2011 through March 2012 for about $15."
1034,12163,Sporting goods stores nationwide from February 2012 through March 2012 for about $50.
1189,12731,"Kawasaki dealers nationwide from August 2011 through March 2012 for between $10,600 and $12,000."
1033,12162,"Target stores nationwide from February 2012 through April 5, 2012 for $3."
1027,12156,Gems sold the recalled 3100 Pressure Transducers directly to end-users and through distributors from January 2006 through February 2012 for about $250.
1028,12157,"Ross Stores, Inc. nationwide from November 2011 through January 2012 for about $20."
1029,12159,"Online at Lenovo's websites, by telephone and direct sales through Lenovo authorized distributors nationwide from May 2010 through March 2012 for about $500 for the M70z model and $800 for the M90z model."
1031,12160,Clothing retail stores nationwide and online from January 2007 through January 2012 for between $12 and $55.
1025,12154,Lowe's stores nationwide from approximately October 2011 through November 2011 for $40.
1024,12153,"Cobra Digital, Lot-Less, Ocean State Jobbers and RadioShack from January 2011 through February 2012 for about $10."
1026,12155,Scuba diving retailers and online between May 2009 and April 2012 for between $44 and $60 for individual hoses.
1188,12730,"Air Venturi, Pyramyd Air, Top Airgun and Straight Shooters stores from January 2012 though March 2012 for about $1,800."
1022,12151,"Authorized Specialized Bicycle Components retailers from April 2010 to February 2012. The bicycle frame modules sold for between $5,500 and $6,100. The brake levers sold for about $80 as service parts."
1023,12152,Home Depot stores nationwide and in Canada and Direct Tools Factory Outlet stores nationwide from March 2011 through February 2012 for between $79 and $350.
1021,12150,Pep Boys and other motor sports stores nationwide from December 2010 through January 2012 for between $450 and $650.
1020,12149,Specialty bicycle stores nationwide from April 2011 through March 2012 for between $400 and $600.
1019,12148,jcpenney stores and online at jcpenney.com from January 2005 through December 2008 for between $150 and $400.
1187,12729,"Authorized Club Car dealers nationwide in April and May 2011 for between $6,000 and $11,000"
1018,12147,"Appliance and specialty retail stores nationwide from June 2010 through March 2012 for between $1,425 and $2,000."
1017,12146,Office Depot retail stores nationwide and online at www.OfficeDepot.com from January 2002 through December 2008 for about $55.
1016,12145,"Public Bikes & Gear in San Francisco and other Public Bikes dealers in 16 states nationwide and publicbikes.com from April 2010 through January 2012 for between $500 and $1,250."
1014,12143,"J&B Imports, REI, Action and Hawley, independent bicycle dealers, distributors and other retail stores nationwide and online at REI.com from January 2009 through April 2012 for between $140 and $180."
1015,12144,"West Elm stores nationwide, the West Elm catalog and website from September 2011 to January 2012 for between $20 and $40."
1013,12141,"Lowes, Sears and Husqvarna dealers and distributors nationwide for between $150 and $320 from May 2011 to January 2012."
1012,12140,Kohl's stores nationwide and www.Kohls.com between February 2012 and March 2012 for about $20.
1010,12139,"Warehouse sales (in temporarily rented space) in Chattanooga and Nashville, Tenn.; Conyers, Ga.; and Bloomington, Ill. from April 2008 through December 2011 for between $5 and $10. The lamps were also given to schools and civic organizations in conjunction with fundraising activities during the same period."
1186,12728,Lakeshore Learning Materials catalogs and online at www.lakeshorelearning.com from May 2011 through January 2012 for about $20.
1009,12138,Sporting goods stores and online from November 2011 through March 2012 for about $250.
1008,12137,"Mattress retailers nationwide from March of 2008 to October of 2011 for about $1,700 to $2,200."
1007,12136,"Bed Bath & Beyond, and other retail stores nationwide and online at Amazon.com from January 2004 through February 2012 for between $2 and $4."
1006,12135,"Home improvement and hardware stores, home centers and electrical product suppliers nationwide and online at www.amazon.com from January 2011 through January 2012 for between $135 and $150."
1005,12134,BonHiver.com and ski and snowboard retailers from November 2011 to December 2011 for between $260 and $350.
1185,12727,"Kawasaki dealers nationwide from June 2011 to February 2012 for between $6,700 and $8,200."
1004,12132,"Lawn and garden retailers nationwide from January 2011 through January 2012 for about between $1,900 and $2,800."
1003,12131,"Various catalogs, Guidecraft.com and other Internet retailers nationwide from July 2010 through April 2011 for about $180."
1001,12129,"Online at Lenovo?s websites, by telephone and direct sales through Lenovo authorized distributors nationwide from May 2010 through January 2012 for about $500 for the M70z model and $800 for the M90z model."
1002,12130,Ross Stores nationwide from April 2011 through January 2012 for about $8.
1000,12128,"Bed Bath & Beyond, CVS, Walgreens and the Locker Brand website from June 2010 through October 2011 for about $15."
1184,12726,"BCI Burke Co. and its distributors from January 2004 through December 2011 for between $700 and $1,000."
998,12125,"Bicycle specialty shops, sporting goods retailers and Amazon.com and other online retailers nationwide from January 2008 through January 2012 for between $40 and $65."
997,12124,"Hardware stores, home centers and lighting showrooms from March 2009 through October 2010 for about $6."
996,12123,"Twin Oaks catalog and website, craft fairs and independent retail stores nationwide from December 2007 through June 2011 for between $100 and $150."
994,12121,Honda Power Equipment dealers nationwide and online from May 2006 to February 2012 for between $420 and $430.
993,12120,"Nationally through distributor outlets and online, including food service companies, broadliners and equipment supply distributors. The mugs were sold between January 2011 and January 2012 for between $4 and $10 each."
991,12119,Distributors of professional tools and products nationwide from September 2011 through November 2011 for about $20.
995,12122,Children's clothing and specialty retailers nationwide and online from January 2004 to December 2011.
1183,12725,"Roofing retailers and installers in Arizona, California, Colorado, Florida, Kansas and Nevada from October 2009 through March 2011. Depending on the solar energy system size, installation cost can range from $15,000 to $100,000."
990,12118,Home Depot and authorized ECHO dealers from August 2011 through January 2012 for about $270.
989,12117,"Various plumbing/HVAC distributors, Home Depot, Lowes and Ace Hardware Stores nationwide and in Canada from October 2004 through January 2012 for about $7 to 13 for cylinders and $45 to 75 for the torch kits."
988,12116,"Juvenile product stores and sporting goods stores nationwide and by Web retailers, including www.kelty.com, from January 2010 through February 2012 for between $375 and $475."
987,12115,"Meijer stores in Illinois, Indiana, Kentucky, Michigan and Ohio from September 2011 through November 2011 for about $20."
1182,12724,GIG sold the GSM radio modules to home security companies and security system equipment distributors nationwide and in Canada between December 2010 and October 2011 for use in Go!Control Panels. Home security companies installed the modules in control panels as part of home security systems that varied greatly in price.
986,12113,Bicycle and specialty stores and dealers nationwide from October 2009 to November 2010 for about $120.
1180,12722,"Honda ATV dealers nationwide from September 2011 to January 2012 for between $5,100 and $5,300."
985,12112,Specialty bicycle stores nationwide from November 2007 through December 2011 for between $300 and $500.
1181,12723,Powersports dealers and online nationwide from January 2011 through November 2011 for about $50.
981,12109,To schools and other facilities with playground equipment nationwide between January 2006 and December 2011 for about $2300.
983,12110,"Tea and coffee specialty stores, gift stores, drug stores, kitchen supply stores, hospital gift shops and other retailers nationwide from December 2011 through January 2012 for about $30."
984,12111,"Juvenile product stores, mass merchandisers and other stores nationwide and on various websites from March 2011 through December 2011 for between $14 and $35."
1179,12721,"Authorized distributors and installers nationwide from May 2009 through October 2011 for about $1,200."
1178,12720,Improvements and Skymall catalogs and online at Improvementscatalog.com and Skymall.com from May 2011 to August 2011 for between $150 and $190.
980,12108,Authorized STIHL dealers nationwide from March 2011 through July 2011 for between $530 and $550.
979,12107,"Department, mass merchandise, home improvement and other stores nationwide and on various websites, including www.tassimodirect.com, from August 2011 through February 2012 for between $8 and $11 per package."
978,12106,"Department, mass merchandise and home improvement stores nationwide and on various websites, including www.tassimodirect.com, from June 2008 through February 2012 for between $100 and $250. The Tassimo Professional model was sold directly to hotels and food service providers and they are being contacted directly."
1177,12719,"The products were sold online from January 2007 through December 2010 for about $1,000 to $2,500 on the websites www.spectrumhome3.com, ww.spectrumhome4.com or www.gallery84.com."
977,12105,Fred's Inc. stores nationwide between October 2011 and November 2011 for about $20.
976,12104,"Buy Buy Baby and other baby product stores nationwide, online at Bumbleride.com, and other online retailers between January 2009 and January 2012 for between $500 and $700."
974,12102,Nationwide between 1995 and 2000 as original equipment in manufactured homes and as replacement furnaces in manufactured homes.
975,12103,"Big Lots, Century 21, Conway, Cookies, Cost Mart, DD?s Discount, Edison Childrenswear, Gabriel Bros., Kiddy Time, Kids Place, Kidstown, National Stores, Pamida Stores, Real Value, Regine?s, R.H. Reny, Ross, Shoppers World, Valley Wholesale, Variety Wholesalers and Youngland stores nationwide. Recalled garments sold from November 2010 through August 2011 for about $4 to $9."
1175,12717,"Various value-added resellers, direct retail sales and authorized Konica Minolta dealers from June 2010 through March 2011 for between $900 and $3,500."
973,12101,"Electronics, computer and camera stores nationwide, and online at www.shopping.hp.com and other websites from November 2004 through December 2011 for between $90 and $120. Some of the recalled fax machines were replacement units for a previous recall involving HP fax model 1010 in June 2008."
1176,12718,"LTD Commodities, ABC Distributing and The Lakeside Collection both online and through catalogs between June 2011 and October 2011 for about $170."
972,12100,"West Elm retail stores nationwide, West Elm catalogs and westelm.com from March 2011 through November 2011 for about $250."
968,12098,"Christmas Tree Shops in the Northeast, Mid-Atlantic and Midwest from November 2011 through December 2011 for about $8."
969,12099,"Christmas Tree Shops in the Northeast, Mid-Atlantic and Midwest regions from December 2010 through November 2011 for about $7."
967,12097,The Container Stores nationwide and on the firm?s website www.containerstore.com from October 2011 through December 2011 for about $15.
1174,12716,"Arctic Cat dealerships nationwide from May 2011 through December 2011 for between $10,500 and $14,500."
966,12096,"Authorized Specialized retailers nationwide from June 2011 through November 2011 for between $1,250 to $2,000."
1171,12713,"KYMCO dealers nationwide from June 2008 to October 2011 for between $7,600 and $10,100."
1172,12714,BJ?s Wholesale Clubs from July 2011 through December 2011 for about $15.
1173,12715,"ParCar dealers from July 1, 2008 to July 31, 2011 for between $5,000 and $12,000."
965,12095,Bicycle specialty stores and dealers nationwide from January 2008 through July 2011 for between $60 and $80.
964,12094,ndependent lawn and garden sales and service stores nationwide from January 2010 through September 2011 for about $20.
963,12093,Various Mexican specialty craft stores nationwide from February 2001 through October 2011 for about $4.
962,12092,Various Mexican specialty craft stores nationwide from June 2000 through October 2011 for between $12 and $14 per pack.
959,12089,"Costco Wholesale Clubs, Leon Korol and Cost U Less stores between May 2007 and September 2008 for about $10."
961,12090,Walmart between August 2008 to December 2011 for about $22.
958,12088,"Authorized Giant Bicycle dealers nationwide from August 2011 through November 2011 for between $3,000 and $4,550."
1170,12712,"Authorized Steelcase dealers and retail outlets including Healthy Back Store, CSN, Home Office Solutions, Office & Company and Sam Flax stores nationwide and online at www.store.steelcase.com from March 2011 through June 2011 for between $350 and $700."
1295,13098,"Independent distributors of Hy Cite Enterprises sold this product through door-to-door sales for between $250 to $800 for individual products and from $800 and $3,500 for sets."
956,12086,Big Lots stores nationwide from April 2010 through November 2011 for between $30 and $50.
957,12087,"Best Buy, Meijer and Walmart stores nationwide from July 2011 through December 2011 for between $50 and $70."
955,12085,Specialty bicycle stores nationwide and on various websites from December 2005 through August 2010 for between $400 and $925 for Chariot bicycle trailers and from October 2002 through August 2011 for between $40 and $70 for bicycle trailer conversion kits.
954,12084,Home decorating and gift stores nationwide from January 2010 to November 2011 for about $14.
1169,12711,"The Land of Nod stores in Illinois and Washington, The Land of Nod catalog and website from September 2009 through October 2011 for about $600 for the twin size and $700 for full size."
953,12082,Bicycle and sports stores and other retailers nationwide and online from August 2006 through November 2011 for about $40.
