RecallID,RecallNumber,RetailerFirm
8222,18712,The Land of Nod stores nationwide and online from May 2015 through September 2017 for about $500.
8223,18073,"Distributed in Colorado, Montana, Nebraska, South Dakota and Wyoming, delivered by various companies and sold by various retailers from April 2015 through October 2017."
8221,18711,"The Veterans Administration in Richmond, Virginia, Milwaukee, Wisconsin and St. Louis, Missouri and online at Indemedical.com, Vidacura.com, Access to Recreation.com, Sportaid.com, The Access Store.com, Austin Wheelchair Co.com and intimaterider.com from September 2017 through November 2017 for about $365 for the chair and $159 for the bench."
8220,18069,"Rocky Mountain bicycle dealers nationwide from June 2017 through November 2017 for between $2,600 and $7,300."
8218,18710,Shoes For Crews catalog and website from August 2017 through October 2017 for between $80 and $135.
8219,18071,"Amazon.com, Wayfair.com, Hayneedle.com and various home furnishing stores nationwide from June 2017 through September 2017 for about $150."
8216,18072,"Authorized Honda Power Equipment dealers and Home Depot stores nationwide from September 2016 through November 2017 for about $1,150."
8217,18074,"Specialty bicycle stores and Brompton dealers nationwide from April 2014 through September 2017 for between $1,200 and $3,000"
8215,18709,"John Deere dealers nationwide from March 2012 through November 2017 for between $13,400 and $16,100."
8212,18707,Bits and Pieces mail order catalog and online at www.bitsandpieces.com from October 2017 through December 2017 for about $50.
8213,18708,"Polaris dealers nationwide from September 2017 through October 2017 for between $22,500 and $25,500."
8214,18070,"Bass Pro Shops stores, catalog, and online at basspro.com from October 2016 through August 2017 for about $25."
8208,18063,"Matrix Fireworks of Wahpeton, N.D. from May 2017 through August 2017 for about $15."
8209,18064,"Del Mar Fans & Lighting, Pacific Ceiling Fans, Wilson Lighting and other lighting stores nationwide and online from January 2016 through September 2017 for between $500 and $550."
8211,18066,Online at squattypotty.com and Amazon.com from September 2017 through November 2017 for about $50
8210,18065,Amazon.com from May 2016 through May 2017 for between $50 and $150.
8207,18062,"Costco stores nationwide and online at Costco.com from January 2016 through August 2017 for about $130; refurbished fans were sold online during the same period on eBay, Amazon, and Groupon."
8205,18059,Pier 1 Imports stores nationwide and online at www.Pier1.com from June 2017 through November 2017 for about $25 for the small glass pumpkin and about $30 for the medium glass pumpkin.
8206,18061,"Bloomingdale?s, Hush Life Boutique, SoulCycle and Todd Snyder stores nationwide and online at www.amazon.com, www.net-a-porter.com, www.soulcycle.com and www.toddsnyder.com from August 2014 through October 2017 for between $140 and $150."
8203,18058,"Amazon.com, Kohls.com, ToyRUs.com, Walmart.com and Wayfair.com from January 2016 through December 2016 for between $40 and $90."
8204,18705,"John Deere dealers nationwide from March 2017 through October 2017 for between $12,000 and $13,900."
8202,18057,"Bass Pro Shops, Cabela?s, Dicks Sporting Goods stores and other stores nationwide from October 2016 through November 2017 for between $8 and $15 when sold separately from other equipment. The arrow nocks were also included as original equipment with Ravin crossbows sold for between $1,500 and $2,000 and Ravin arrows sold for between $75 and $110."
8201,18056,Foreman Mills stores nationwide from September 2016 through November 2017 for about $6.
8200,18055,"Online at Amazon.com, apelectricgenerators.com, Climate Right.com, Homedepot.com, Houzz.com, Menards.com, PowerEquipmentDirect.com, and Walmart.com from June 2017 through October 2017 for between $580 and $600."
8199,18053,"Industrial, construction, welding supply distributors, including Purvis Industries, WeldStar Co., Pennsylvania Tool Sales and Service, and online at OhioPowerTool.com from April 2017 through October 2017 for about $350."
8198,18047,Fry?s electronics stores nationwide and online at Frys.com and Amazon.com from June 2017 through October 2017 for about $20.
8197,18052,"West Elm stores nationwide, West Elm?s catalog and online at www.westelm.com from June 2014 through October 2017 for about $130 for the lamp with a USB and for between $80 and $100 for the lamp without a USB."
8196,18051,"Powersports dealers nationwide from August 2016 through May 2017 for about $4,800."
8194,18050,"Design Within Reach, Lumens, Ylighting, and other lighting stores and online at Flos.com from January 1996 through December 2006 for between $800 and $1,900."
8195,18704,"Authorized Kubota dealers nationwide from June 2015 through June 2017 for between $15,000 and $25,000."
8193,18049,"Albertsons/Safeway, Giant, Harris Teeter, Meijer, Stop & Shop and Rite-Aid stores nationwide and online at Jet.com and Amazon.com from June 2017 through October 2017 for about $19."
8192,18046,"Libbey outlet stores in Shreveport, Louisiana and Toledo, Ohio, Total Wine stores nationwide, various distillery gift shops, commercial customers for use in restaurants, and online at libbey.com, iwawine.com and kybourbontrailshop.com from May 2017 through October 2017 for between $20 and $25 for the four-piece set, and $6 for the glass sold individually."
8191,18045,Babies?R?Us and Toys?R?Us stores nationwide from January 2017 through October 2017 for about $10.
8190,18703,"Colleges, stadiums and other public facilities nationwide from October 2014 through February 2017 for between $5,500 and $10,000."
8186,18040,IKEA stores nationwide and online at www.IKEA.com from January 2002 through June 2016 for between $70 and $200. Other chests and dressers subject to this recall were sold between approximately 1985 and June 2016.
8187,18041,"Arizona Hiking Shack, Atlantic Diving Supply, Austin Canoe & Kayak, Columbus Supply, Dvbe Supply, Evac Systems, General Factory/WD Supply, Lafco Outillage, The Rescue Source, Witmer Associates (Firestone) stores nationwide and online at omega.com from February 2017 through October 2017 for between $31 and $51."
8189,18044,Kelseyville Lumber and Trademark Exteriors as stock items and at Home Depot as a special order item from February 2014 through June 2017 for between $25 to $30 per board for the decking and about $25 to $40 per board for the fascia.
8188,18042,"Clothes Pony and Caro Bambino stores nationwide and online at Amazon.com, Zulily.com and Woolino.com from May 2015 through November 2017 for between $50 and $60."
8185,18702,"Sleep Number stores and online from April 2017 to August 2017 for between $5,400 and $11,000 for smart beds sold with foot warmers."
8183,18037,"Arctic Cat dealers nationwide from February 2017 through August 2017 for about $17,000 for the ROVs with the winch accessory kits installed. The winch accessory kits were also sold separately from December 2013 through August 2017 for between $200 and $600."
8184,18038,"Bass Pro Shops, Cabela's, Kinsey's Archery and other archery and hunting sporting goods stores nationwide and online at PSE-archery.com from October 2016 through August 2017 for between $300 and $500."
8182,18036,"Bush Hog dealers nationwide from February 2017 to September 2017 for between $6,200 and $7,200."
8181,18035,Wholesale Fireworks stores in Wyoming from June 2017 through August 2017 for between $13 and $90.
8174,18027,"Drone Nerds store in Aventura, Florida and online at www.dronenerds.com from November 2015 through March 2016 for about $300."
8175,18028,"Village Mart store in Memphis, Tennessee from October 2015 to March 2016 for about $200."
8176,18029,"Amazon.com, iHoverspeed.com and other online retailers from November 2015 to December 2015 for between $290 and $330."
8177,18030,"Ace Hardware and hh gregg stores nationwide, Heartland America catalogs and online at AceHardware.com and hhgregg.com from April 2016 through March 2017 for between $170 and $200."
8180,18034,"Salvage World stores in Hattiesburg, Mississippi from August 2016 through March 2017 for about $150."
8179,18032,"Dollar Mania stores in Bossier City and Shreveport, Louisana from August 2015 through December 2016 for about $200."
8178,18031,Online at www.techdrift.com and www.amazon.com from December 2015 through April 2016 for between $400 and $500.
8173,18026,"OshKosh, Bon-Ton, Kohl?s, Fred Meyer and other retail and department stores nationwide, and online at www.oshkosh.com between August 2017 and September 2017 for between $35 and $40.?"
8172,18025,"Norco Bicycles dealers nationwide from May 2016 through September 2017 for between $400 and $1,700."
8171,18023,Online at Amazon.com and Wealers.com from May 2016 through July 2016 for about $12 for a 6 pack and $17 for a 12 pack.
8170,18022,"Menards, Montgomery Ward, Sears, The Home Depot, Walmart and other department, home and hardware stores nationwide, and online at Amazon.com, ShopKidde.com and other online retailers for between $12 and $50 and for about $200 for model XL 5MR. These fire extinguishers were also sold with commercial trucks, recreational vehicles, personal watercraft and boats."
8169,18021,Children?s boutique stores nationwide and online at www.dondolo.com from November 2014 through October 2017 for between $15 and $50.
8168,18020,Nordstrom and children?s boutiques nationwide and online at www.littlemass.com from July 2016 through October 2017 for between $27 and $42.
8167,18019,Amazon.com from January 2017 through October 2017 for between $11 and $17.
8166,18018,"Polaris dealers nationwide from December 2015 through September 2015 for between $16,000 and $21,000."
8165,18017,"Arctic Cat dealers nationwide from December 2013 through August 2017 for between $10,500 and $19,500."
8163,18701,Authorized Diving Unlimited International dealers nationwide and online at www.divegearexpress.com and https://www.divedui.com/ from February 2017 through June 2017 for about $500.
8164,18016,"Specialty toy and baby product stores nationwide and online at Diapers.com, Target.com and other websites from September 2016 through May 2017 for about $50."
8162,18015,"BuybuyBaby, Target, Toys R Us, Walmart and other stores nationwide and online at Amazon.com and other websites from November 2015 through October 2017 for about $160 for the Soothing Motions Seat and $175 for the Smart Connect Soothing Motions Seat."
8161,18013,"Appliance and specialty retailers, department stores, authorized builder distributors, and home improvement stores nationwide and online from January 2013 through May 2015 for between $850 and $2,600."
8160,18012,"Carter?s, Target, Walmart and other stores nationwide and online from January 2016 through August 2017 for between $11 and $20."
8159,18700,"John Deere dealers nationwide from July 2017 through August 2017 for between $3,800 and $8,000."
8157,18010,"Herman Miller, Design Within Reach and Herman Miller?s authorized retailers and dealers nationwide and online at http://store.hermanmiller.com and www.dwr.com from May 2013 through September 2017 for about $650 (non-upholstered) and $890 (upholstered)."
8158,18011,"Polaris dealers nationwide from December 2014 through July 2017 for about $7,500."
8156,18009,Target stores nationwide and online from June 2017 through August 2017 for about $35.
8155,18008,"Macy?s stores nationwide and online, and at Military Exchanges between January 2014 and July 2017 for about $25 at Macy?s and $15 at Military Exchanges."
8154,18007,Cost Plus World Market and World Market stores nationwide and online at www.worldmarket.com from January 2017 through August 2017 for about $180.
8153,18006,Home Depot stores nationwide and online at www.HomeDepot.com from February 2017 through July 2017 for about $5.
8152,18004,Babies ?R? Us and Toys ?R? Us stores nationwide from June 2016 through January 2017 for about $13.
8150,18002,"Specialty bike stores nationwide and online at www.jenson.com and www.REI.com from June 2014 to May 2017 for about $40, and installed as original equipment on ElliptiGO model 11R elliptical cycles from October 2014 to May 2017 for about $3,500."
8151,18003,Nationwide at retailers specializing in scuba diving equipment from October 2003 to April 2017 for about $440.
8149,18001,"Babies?R?Us, Target, Walmart, and other stores nationwide and online at Amazon.com from October 2009 through August 2017 for about $2.50 for a single plate or bowl and $15 for a Mealtime set."
8148,17235,"Babies R Us, Buy Buy Baby, Target and other retailers nationwide and online at Skiphop.com and Amazon.com from July 2016 through August 2017 for approximately $40."
8147,17234,DICK?S Sporting Goods stores nationwide and online at DicksSportingGoods.com from September 2015 through August 2017 for between $15 and $80.
8146,17233,"Specialty outdoor living stores nationwide, including Family Leisure, Fortunoff Backyard Store, and Watson?s, and through authorized websites and catalogs including Bed, Bath & Beyond and Frontgate, from September 2011 to May 2017 for between $800 and $2,000. The price of the LP conversion kit ranges from $90 to $105. The warranty parts were also sold as service parts for between $50 and $110."
8144,17231,"Target, Walmart and other stores nationwide and Shopko stores in Wisconsin from August 2015 through August 2016 for between $130 and $160."
8145,17232,"McCully Bicycle & Sporting Goods, Quality Bicycle Products, Uncle Funky?s Boards, and other sports specialty stores nationwide and online at Amazon.com and ProtecB2C.com from February 2016 through January 2017 for about $80 for the City Lite helmet, and about $60 for the Street Lite helmet."
8143,17230,Renthal motorcycle dealers nationwide from April 2009 through July 2017 for about $215.
8141,17228,"Christus Health Retail Systems, Joseph-Beth Booksellers, More Than Words, The Mole Hole of Peddlers Village & Eash Sales from June 2017 through August 2017 for about $25."
8142,17229,"Fireworks Over America wholesale distribution centers and retail fireworks stores, tents, and stands nationwide from October 2016 through July 2017 for about $10."
8140,17227,"John Deere dealers, Home Depot and Lowe?s stores nationwide from February 2016 through July 2017 for about $1,500. The service transmissions were sold by John Deere authorized dealers from March 2016 through August 2017 for about $300."
8139,17224,Moonrays and home improvement and hardware stores nationwide and online from August 2016 through March 2017 for about $20.
8138,17223,Target stores nationwide and online at Target.com from January 2013 through April 2016 for about $118.
8137,17222,"Christmas Tree Shops, andThat!, and Christmas Tree Shops andThat! stores nationwide from February 2015 to May 2017 for about $100 for the entire set."
8134,17766,"L.L. Bean stores nationwide, L.L. Bean catalog and online at www.llbean.com from April 2017 through August 2017 for about $50."
8135,17219,"Specialty ski and snowboard shops and by major retailers such as REI, online at Backcountry.com, Smithoptics.com, and other online retailers, from October 2016 through July 2017 for about $300."
8136,17220,"Book and other retail stores nationwide, book fairs and clubs, and online at Amazon.com, Barnesandnoble.com, Walmart.com and other online retailers from September 2016 through August 2017 for about $13."
8132,17217,Walmart stores and other retailers nationwide and online at Walmart.com from April 2009 through May 2016 for about $60.
8133,17218,"Kawasaki dealers nationwide from November 2011 through June 2017 for about $4,300."
8130,17764,"Authorized Honda Powersports dealers nationwide from September 2014 through August 2017 for about $8,700."
8131,17765,Amazon.com from December 2016 through July 2017 for between $16 and $21.
8129,17216,Hallmark Gold Crown stores nationwide and online at Hallmark.com and Amazon.com from June 2016 through July 2017 for about $30.
8128,17215,"4 Our Little Ones, Babies R? Us, Bebeang, Buy Buy Baby, Drugland Pharmacy, Family First Pharmacy, Global Nutrition Trading, Macro and Turquoise stores nationwide and online at Amazon.com from September 2016 to June 2017 for between $3 and $7."
8127,17212,Cracker Barrel Old Country Store stores nationwide from April 2017 through July 2017 for about $20.
8125,17210,"Ski and outdoor specialty stores such as Moosejaw and REI nationwide and online at Arcteryx.com and retailer websites such as Moosejaw.com and REI.com from April 2016 through March 2017 for between $750 and $1,000."
8126,17211,"Dr. Martens, Journeys and independent stores nationwide and online at Amazon.com, DrMartens.com, Shoebuy.com and other websites from January 2015 through July 2017 for about $125."
8123,17208,Academy Sports + Outdoors stores and online at Academy.com from March 2014 through May 2017 for about $130.
8124,17209,Plant food and hydroponic stores nationwide from November 2016 through July 2017 for about $33.
8122,17763,"Polaris dealers nationwide from June 2016 through July 2017 for between $16,300 and $19,000."
8121,17762,The refurbished cellphones were distributed by FedEx Supply Chain and provided as replacement phones only through AT&T?s Insurance program between December 2016 and April 2017.
8120,17207,"Home Goods, Kidding Around, Nordstrom and other specialty toy and mass retailer stores nationwide and online at Amazon.com, from March 2015 through June 2017 for about $13."
8118,17205,"Gerler and Son Inc., Grainger Inc., Safety Solutions Inc., Standup Rancher and other independent safety stores nationwide and online at Kohls.com, Steel-Toe-Shoes.com, Thewesterncompany.com, Workboots.com, from October 2013 through June 2017 for between $80 and $130."
8119,17206,"Dillard?s stores nationwide and online at Amazon.com, Dillards.com and Zulily.com from January 2017 through July 2017 for between $27 and $40."
8117,17204,"Kawasaki dealers nationwide from October 2011 through May 2017 for between $2,000 and $2,600."
8115,17202,"Meijer stores in Illinois, Indiana, Kentucky, Michigan, Ohio, and Wisconsin from January 2017 through July 2017 for about $14."
8114,17201,"Online at NVIDIA.com, Amazon.com, BestBuy.com, and NewEgg.com from October 2015 through June 2017 for about $30."
8116,17203,"Polaris dealers nationwide from April 2013 through June 2017 for about $13,300."
8113,17761,Firewoodvapes.com from October 2016 through June 2017 for between $135 and $185.
8111,17199,"RH outlet stores nationwide and online at www.RH.com and www.RHmodern.com from December 2015 through June 2017 for between $750 and $6,800."
8112,17200,Amazon.com from December 2015 through March 2017 for between $20 and $22.
8110,17198,"Fred?s stores in: Alabama, Arkansas, Georgia, Illinois, Kentucky, Louisiana, Mississippi, Missouri, North Carolina, Oklahoma, South Carolina, Tennessee and Texas from January 2017 through June 2017 for about $22."
8109,17197,Children?s boutique stores nationwide and online at www.mysweetbamboo.com from February 2016 through May 2017 for about $40.
8108,17196,"Amazon, Henri Bendel, MixBin, Nordstrom Rack, Tory Burch and Victoria?s Secret stores nationwide and online from October 2015 through June 2017 for between $15 and $65."
8107,17192,"Discount School Supply, Kaplan Early Learning Company, Panelcraft and Tout About Toys from November 2016 through January 2017 for between $120 and $150."
8106,17760,"These units were sold and rented to businesses nationwide from April 2011 through April 2017 as part of individual service contracts with Nestl� Waters. A limited number of units were purchased by these consumers for between $700 and $900, depending on the filtration system used. Nestl� Waters does not sell or provide these units at retail."
8105,17757,Really Good Stuff catalogs nationwide and online at www.reallygoodstuff.com from March 2003 through April 2017. The boards were sold individually and in sets of six for between $10 and $47
8103,17759,Amazon.com from July 2016 through August 2016 for about $20.
8104,17195,"Polaris dealers nationwide from February 2015 through July 2017 for between $4,600 and $4,800."
8102,17194,"M&M Discount, Tremont Discount and other independent mattress stores in the Greater New York City area and online at Ababy.com for about $65 and distributed free through various charitable organizations including August Aichorn from January 2015 through January 2017."
8101,17193,"Fallas Stores of Los Angeles, California, and T.J. Maxx and Marshalls stores nationwide from December 2015 through December 2016 for between $300 and $400."
8100,17758,At www.amazon.com from February 2015 through May 2017 for between $23 and $25.
8099,17191,Toy stores nationwide and online at www.manhattantoy.com and other websites from May 2015 through September 2016 for about $15.
8098,17190,"Polaris dealers from April 2014 through May 2017 for between $6,500 and $7,700."
8097,17189,"CJ Pony Parts Inc., Latemodel Restoration, Transamerican Auto Parts and other aftermarket auto parts stores nationwide and online at www.corbeau.com from April 2016 through April 2017 for about $150."
8096,17756,"Polaris dealers nationwide from December 2016 through June 2017 for about $8,500."
8094,17187,HomeGoods stores nationwide from May 2017 through June 2017 for about $4.
8095,17188,"Babies R Us, Toy R Us and other retail stores nationwide and online at Amazon.com from May 2016 through July 2017 for about $16."
8093,17186,"Ace Hardware, Home Depot, Kamps, Propane Depot, U-Haul and other stores nationwide and online at Amazon.com and other websites from November 2013 through September 2016 for between $10 and $15."
8091,17755,"Core distributors nationwide from November 2010 through April 2017, and by Unisen distributors from 2001 to 2010 for between $2,700 and $8,400."
8092,17185,"CanadaAmmo ,Wyvern Creations and other stores nationwide and online at www.triggertech.com from June 2015 to August 2016 for between $120 and$ 190."
8090,17754,"Superpedestrian.com from March 2017 through April 2017 for about $1,500."
8089,17753,"Independent Cub Cadet dealers nationwide from March 2016 through May 2017 for between $8,500 to $9,500."
8088,17184,Home Depot stores in Puerto Rico and U.S. Virgin Islands sold the Hampton Bay 3-Light Crystal chandeliers from September 2013 through February 2017. Home Depot stores nationwide sold the Home Decorators Collection 4-Light Crystal chandeliers from October 2015 through February 2017. Both sold for about $220.
8087,17183,"Babies R Us, BuyBuy Baby, and online at babiesrus.com, buybuybaby.com, amazon.com, kohls.com, target.com, zulily.com, diapers.com, hautelook.com, and burtsbeesbaby.com from December 2016 through May 2017 for about $18."
8086,17179,Home Depot stores nationwide and online at www.homedepot.com from December 2014 through March 2017 for between $95 and $110.
8085,17752,Target.com from May 2015 through August 2016 for about $160.
8084,17182,"Online at Amazon.com, Walmart.com, Wayfair.com and other online retailers from February 2005 through December 2016 for about $160."
8083,17181,"Albertsons, Kroger, Meijer, Target, Wal-Mart and other retailers in Illinois, Ohio, Vermont and Wisconsin from May 2017 through June 2017 about $5."
8081,17751,"Kawasaki dealers nationwide from March 2017 through April 2017 for between $8,000 and $15,000."
8082,17180,"Staples? stores nationwide and online at staples.com, staplesadvantage.com, and quill.com from October 2014 through April 2017 for between $100 and $180."
8080,17750,Independent bicycle frame builders from June 2015 through December 2015 for about $575 for the fork
8079,17749,At www.amazon.com from October 2015 through August 2017 for between $11 and $14.
8078,17178,Children?s specialty stores nationwide and online at www.littlegiraffe.com from November 2012 through March 2017 for about $100.
8076,17176,Authorized GTHI dealers and outdoor specialty stores nationwide and online at www.trango.com from October 2016 through April 2017 for about $90.
8077,17177,"Online at Amazon, Overstock and Wayfair, and from September 2016 through March 2017 for about $130."
8075,17175,Bicycle stores nationwide from June 2016 to August 2017 for between $440 and $800.
8072,17172,"Electrical distributors nationwide and online through the commercial desk at 1000Bulbs.com, Amazon.com, ATGStores.com, Build.com, HD.com, ShineRetrofits.com, and Wayfair.com from February 2016 through March 2017 for between $150 and $200."
8073,17173,Do It Best stores and other independent hardware stores nationwide from January 2013 through May 2017 for between $20 and $35.
8074,17174,"Leslie?s Pool Supply and other retail stores, wholesale pool suppliers including Pool Builders Supply, Pool Corp., Pool & Electrical Products, and United Aqua Group from September 2010 through October 2016 for between $400 and $500."
8071,17748,"Arctic Cat dealerships nationwide from June 2016 through May 2017 for between $13,200 and $16,900."
8070,17171,"Layette (Dallas, Texas), Hip Hip Hip Hooray (Dallas, Texas) and Born Children's (Montgomery, Alabama) stores and on-line at www.lilaandhayes.com from February 2017 through April 2017 for between $45 and $65."
8069,17169,"Online at Amazon.com and at gift and specialty stores in California, Iowa, New York, Ohio and Texas from September 2013 through April 2017 for between $15 and $17."
8068,17168,"Lowe?s and other retailers nationwide and online at Amazon.com, Lowes.com and other websites from May 2014 through July 2016 for about $350."
8067,17167,"Grainger, Platt Electric Supply stores and industrial and electrical distributors and wholesalers nationwide and online at Amazon.com and other websites from January 2016 through April 2017 for between $110 and $230."
